{
    "document_types": {
        "DCC_SUBMITTAL": {
            "schema_file": "config/dcc_register.json",
            "description": "DCC Submittal Register"
        },
        "DCC_ENHANCED": {
            "schema_file": "config/dcc_register_enhanced.json",
            "description": "Enhanced DCC Register with Universal Processing"
        },
        "RFI_TRACKER": {
            "schema_file": "config/rfi_register.json",
            "description": "Request for Information Logs"
        }
    },
    "tools": {
        "PROJECT_SETUP": {
            "tool_file": "tools/project_setup_tools.py",
            "description": "Comprehensive project setup and analysis tools",
            "functions": [
                "analyze_columns",
                "compare_column_handling", 
                "validate_document_id_logic",
                "update_column_sequence",
                "reorganize_schema_columns",
                "run_complete_analysis"
            ]
        },
        "UNIVERSAL_COLUMN_MAPPER": {
            "tool_file": "universal_column_mapper.py",
            "description": "Universal column mapper with fuzzy matching and schema integration",
            "functions": [
                "load_main_schema",
                "detect_columns",
                "rename_dataframe_columns",
                "get_column_bounds"
            ]
        },
        "UNIVERSAL_DOCUMENT_PROCESSOR": {
            "tool_file": "universal_document_processor.py",
            "description": "Universal document processor with schema-driven calculations and null handling",
            "functions": [
                "load_schema",
                "process_data",
                "apply_null_handling",
                "apply_calculations",
                "validate_data"
            ]
        }
    },
    "workflows": {
        "UNIVERSAL_PROCESSING": {
            "notebook": "workflow/dcc_mdl_universal.ipynb",
            "description": "Complete universal document processing workflow",
            "steps": [
                "Load enhanced schema",
                "Universal column mapping",
                "Document processing",
                "Data export"
            ]
        },
        "DCC_MAIN": {
            "notebook": "workflow/dcc_mdl.ipynb",
            "description": "Main DCC processing workflow with column updates"
        },
        "DCC_COPY": {
            "notebook": "workflow/dcc_mdl_copy.ipynb",
            "description": "Backup copy of DCC processing workflow"
        },
        "PDF_TRANSMITTAL": {
            "notebook": "workflow/pdf_transmittal_extraction.ipynb",
            "description": "PDF transmittal extraction workflow"
        },
        "COMMON_JSON_TOOLS": {
            "notebook": "workflow/common_json_tools.ipynb",
            "description": "Common JSON processing tools and utilities"
        },
        "EXCEL_EXPLORER": {
            "workflow_file": "workflow/excel-explorer-workflow.md",
            "description": "Excel data exploration and analysis workflow"
        },
        "STAGE_BASED_PROCESSING": {
            "workflow_files": [
                "workflow/stage-map.md",
                "workflow/stage1-file-upload.md",
                "workflow/stage2-sheet-selection.md",
                "workflow/stage3-range-configuration.md",
                "workflow/stage4-data-loading.md",
                "workflow/stage5-column-selection.md",
                "workflow/stage6-filter-configuration.md",
                "workflow/stage7-data-processing.md",
                "workflow/stage8-data-visualization.md",
                "workflow/stage9-export.md"
            ],
            "description": "Complete stage-based processing workflow from file upload to export"
        },
        "COLUMN_UPDATE_LOGIC": {
            "workflow_file": "workflow/column_update_logic.md",
            "description": "Column update logic documentation with mermaid flowchart"
        },
        "SCHEMA_PROCESSING_RULES": {
            "workflow_file": "workflow/schema-processing-rules.md",
            "description": "Comprehensive schema and processing rules documentation"
        }
    },
    "documentation": {
        "PROJECT_PLAN": {
            "file": "reference/dcc/project-plan.md",
            "description": "Comprehensive project plan and status tracking"
        },
        "WORKFLOW_DIAGRAM": {
            "file": "workflow/universal-processing-workflow.md",
            "description": "Complete workflow documentation with Mermaid diagrams"
        }
    }
}